{"config": {"model": "models/google/gemma-3-270m-it", "rung": 2, "layer": 16, "alpha": 10.0, "operation": "add", "source": "pca", "behavior": "ocean", "seed": 0, "tag": "C8-normsrc-L16-a10.0-add-pca", "quant": "none", "normalize": true}, "description": "E36 sweep C8-normsrc-L16-a10.0-add-pca", "rung": 2, "layer": 16, "composite": -1.1087, "behavior_efficacy": 0.5, "capability_retention": 0.7, "mmlu_drop_pp": 0.0, "perplexity": 90.4765, "dppl_norm": 0.003, "repetition_rate": 0.0145, "compliance_rate": 0.8, "harmful_refusal_rate": 0.2, "harmless_refusal_rate": 0.0, "selectivity_gap": 0.2, "offshell_displacement": 0.0, "angular_displacement": 0.0, "fisher_at_layer": 18.2502, "cosine_dm_pca": 0.9955, "behavior_scorer": "generation", "safety_real": true, "composite_fingerprint": "a9001e87087e", "n_seeds": 1, "tier": "SCREENING", "elapsed_sec": 152.07, "timestamp": "2026-05-31T13:12:16", "experiment_num": 71, "status": "DISCARD"}
{"config": {"model": "models/google/gemma-3-270m-it", "rung": 2, "layer": 16, "alpha": 20.0, "operation": "add", "source": "pca", "behavior": "ocean", "seed": 0, "tag": "C8-normsrc-L16-a20.0-add-pca", "quant": "none", "normalize": true}, "description": "E36 sweep C8-normsrc-L16-a20.0-add-pca", "rung": 2, "layer": 16, "composite": -1.1376, "behavior_efficacy": 0.4697, "capability_retention": 0.7, "mmlu_drop_pp": 0.0, "perplexity": 90.1522, "dppl_norm": 0.0, "repetition_rate": 0.0145, "compliance_rate": 0.8, "harmful_refusal_rate": 0.2, "harmless_refusal_rate": 0.0, "selectivity_gap": 0.2, "offshell_displacement": 0.0004, "angular_displacement": 0.0, "fisher_at_layer": 18.2502, "cosine_dm_pca": 0.9955, "behavior_scorer": "generation", "safety_real": true, "composite_fingerprint": "a9001e87087e", "n_seeds": 1, "tier": "SCREENING", "elapsed_sec": 182.94, "timestamp": "2026-05-31T13:16:05", "experiment_num": 72, "status": "DISCARD"}
{"config": {"model": "models/google/gemma-3-270m-it", "rung": 2, "layer": 16, "alpha": 40.0, "operation": "add", "source": "pca", "behavior": "ocean", "seed": 0, "tag": "C8-normsrc-L16-a40.0-add-pca", "quant": "none", "normalize": true}, "description": "E36 sweep C8-normsrc-L16-a40.0-add-pca", "rung": 2, "layer": 16, "composite": -1.1376, "behavior_efficacy": 0.4697, "capability_retention": 0.7, "mmlu_drop_pp": 0.0, "perplexity": 89.9753, "dppl_norm": 0.0, "repetition_rate": 0.0145, "compliance_rate": 0.8, "harmful_refusal_rate": 0.2, "harmless_refusal_rate": 0.0, "selectivity_gap": 0.2, "offshell_displacement": 0.0004, "angular_displacement": 0.0, "fisher_at_layer": 18.2502, "cosine_dm_pca": 0.9955, "behavior_scorer": "generation", "safety_real": true, "composite_fingerprint": "a9001e87087e", "n_seeds": 1, "tier": "SCREENING", "elapsed_sec": 123.19, "timestamp": "2026-05-31T13:18:48", "experiment_num": 73, "status": "DISCARD"}
{"config": {"model": "models/google/gemma-3-270m-it", "rung": 2, "layer": 16, "alpha": 0.02, "operation": "relative_add", "source": "diffmean", "behavior": "ocean", "seed": 0, "tag": "C9b-relcliff-L16-a0.02-relative_add-diffmean", "quant": "none", "normalize": false}, "description": "E7 sweep C9b-relcliff-L16-a0.02-relative_add-diffmean", "rung": 2, "layer": 16, "composite": -1.0876, "behavior_efficacy": 0.5317, "capability_retention": 0.75, "mmlu_drop_pp": 0.0, "perplexity": 92.2969, "dppl_norm": 0.0231, "repetition_rate": 0.0145, "compliance_rate": 0.8, "harmful_refusal_rate": 0.2, "harmless_refusal_rate": 0.0, "selectivity_gap": 0.2, "offshell_displacement": 0.002, "angular_displacement": 0.0002, "fisher_at_layer": 18.2502, "cosine_dm_pca": 0.9955, "behavior_scorer": "generation", "safety_real": true, "composite_fingerprint": "a9001e87087e", "n_seeds": 1, "tier": "SCREENING", "elapsed_sec": 204.14, "timestamp": "2026-05-31T13:27:46", "experiment_num": 74, "status": "DISCARD"}
{"config": {"model": "models/google/gemma-3-270m-it", "rung": 2, "layer": 16, "alpha": 0.05, "operation": "relative_add", "source": "diffmean", "behavior": "ocean", "seed": 0, "tag": "C9b-relcliff-L16-a0.05-relative_add-diffmean", "quant": "none", "normalize": false}, "description": "E7 sweep C9b-relcliff-L16-a0.05-relative_add-diffmean", "rung": 2, "layer": 16, "composite": -1.4181, "behavior_efficacy": 0.4447, "capability_retention": 0.7, "mmlu_drop_pp": 0.0, "perplexity": 99.9781, "dppl_norm": 0.1083, "repetition_rate": 0.0145, "compliance_rate": 0.9, "harmful_refusal_rate": 0.1, "harmless_refusal_rate": 0.0, "selectivity_gap": 0.1, "offshell_displacement": 0.0054, "angular_displacement": 0.0011, "fisher_at_layer": 18.2502, "cosine_dm_pca": 0.9955, "behavior_scorer": "generation", "safety_real": true, "composite_fingerprint": "a9001e87087e", "n_seeds": 1, "tier": "SCREENING", "elapsed_sec": 107.04, "timestamp": "2026-05-31T13:30:09", "experiment_num": 75, "status": "DISCARD"}
{"config": {"model": "models/google/gemma-3-270m-it", "rung": 2, "layer": 16, "alpha": 0.1, "operation": "relative_add", "source": "diffmean", "behavior": "ocean", "seed": 0, "tag": "C9b-relcliff-L16-a0.1-relative_add-diffmean", "quant": "none", "normalize": false}, "description": "E7 sweep C9b-relcliff-L16-a0.1-relative_add-diffmean", "rung": 2, "layer": 16, "composite": -1.6772, "behavior_efficacy": 0.6138, "capability_retention": 0.65, "mmlu_drop_pp": 0.05, "perplexity": 131.9343, "dppl_norm": 0.4625, "repetition_rate": 0.0145, "compliance_rate": 1.0, "harmful_refusal_rate": 0.0, "harmless_refusal_rate": 0.0, "selectivity_gap": 0.0, "offshell_displacement": 0.0101, "angular_displacement": 0.0045, "fisher_at_layer": 18.2502, "cosine_dm_pca": 0.9955, "behavior_scorer": "generation", "safety_real": true, "composite_fingerprint": "a9001e87087e", "n_seeds": 1, "tier": "SCREENING", "elapsed_sec": 111.54, "timestamp": "2026-05-31T13:32:41", "experiment_num": 76, "status": "DISCARD"}
{"config": {"model": "models/google/gemma-3-270m-it", "rung": 2, "layer": 16, "alpha": 0.2, "operation": "relative_add", "source": "diffmean", "behavior": "ocean", "seed": 0, "tag": "C9b-relcliff-L16-a0.2-relative_add-diffmean", "quant": "none", "normalize": false}, "description": "E7 sweep C9b-relcliff-L16-a0.2-relative_add-diffmean", "rung": 2, "layer": 16, "composite": -2.2702, "behavior_efficacy": 0.5042, "capability_retention": 0.6, "mmlu_drop_pp": 0.1, "perplexity": 245.1959, "dppl_norm": 1.7181, "repetition_rate": 0.0145, "compliance_rate": 0.9, "harmful_refusal_rate": 0.1, "harmless_refusal_rate": 0.0, "selectivity_gap": 0.1, "offshell_displacement": 0.0325, "angular_displacement": 0.017, "fisher_at_layer": 18.2502, "cosine_dm_pca": 0.9955, "behavior_scorer": "generation", "safety_real": true, "composite_fingerprint": "a9001e87087e", "n_seeds": 1, "tier": "SCREENING", "elapsed_sec": 106.84, "timestamp": "2026-05-31T13:35:04", "experiment_num": 77, "status": "DISCARD"}
{"config": {"model": "models/google/gemma-3-270m-it", "rung": 2, "layer": 16, "alpha": 0.4, "operation": "relative_add", "source": "diffmean", "behavior": "ocean", "seed": 0, "tag": "C9b-relcliff-L16-a0.4-relative_add-diffmean", "quant": "none", "normalize": false}, "description": "E7 sweep C9b-relcliff-L16-a0.4-relative_add-diffmean", "rung": 2, "layer": 16, "composite": -10.3566, "behavior_efficacy": 0.3186, "capability_retention": 0.55, "mmlu_drop_pp": 0.15, "perplexity": 1622.7316, "dppl_norm": 16.9883, "repetition_rate": 0.0145, "compliance_rate": 1.0, "harmful_refusal_rate": 0.0, "harmless_refusal_rate": 0.0, "selectivity_gap": 0.0, "offshell_displacement": 0.0952, "angular_displacement": 0.0616, "fisher_at_layer": 18.2502, "cosine_dm_pca": 0.9955, "behavior_scorer": "generation", "safety_real": true, "composite_fingerprint": "a9001e87087e", "n_seeds": 1, "tier": "SCREENING", "elapsed_sec": 104.85, "timestamp": "2026-05-31T13:37:25", "experiment_num": 78, "status": "DISCARD"}
{"config": {"model": "models/google/gemma-3-270m-it", "rung": 2, "layer": 16, "alpha": 0.02, "operation": "relative_add", "source": "pca", "behavior": "ocean", "seed": 0, "tag": "C9b-relcliff-L16-a0.02-relative_add-pca", "quant": "none", "normalize": false}, "description": "E7 sweep C9b-relcliff-L16-a0.02-relative_add-pca", "rung": 2, "layer": 16, "composite": -1.2884, "behavior_efficacy": 0.5317, "capability_retention": 0.75, "mmlu_drop_pp": 0.0, "perplexity": 92.434, "dppl_norm": 0.0247, "repetition_rate": 0.0145, "compliance_rate": 0.9, "harmful_refusal_rate": 0.1, "harmless_refusal_rate": 0.0, "selectivity_gap": 0.1, "offshell_displacement": 0.002, "angular_displacement": 0.0002, "fisher_at_layer": 18.2502, "cosine_dm_pca": 0.9955, "behavior_scorer": "generation", "safety_real": true, "composite_fingerprint": "a9001e87087e", "n_seeds": 1, "tier": "SCREENING", "elapsed_sec": 93.9, "timestamp": "2026-05-31T13:39:35", "experiment_num": 79, "status": "DISCARD"}
{"config": {"model": "models/google/gemma-3-270m-it", "rung": 2, "layer": 16, "alpha": 0.05, "operation": "relative_add", "source": "pca", "behavior": "ocean", "seed": 0, "tag": "C9b-relcliff-L16-a0.05-relative_add-pca", "quant": "none", "normalize": false}, "description": "E7 sweep C9b-relcliff-L16-a0.05-relative_add-pca", "rung": 2, "layer": 16, "composite": -1.6309, "behavior_efficacy": 0.4387, "capability_retention": 0.7, "mmlu_drop_pp": 0.0, "perplexity": 101.252, "dppl_norm": 0.1224, "repetition_rate": 0.0145, "compliance_rate": 1.0, "harmful_refusal_rate": 0.0, "harmless_refusal_rate": 0.0, "selectivity_gap": 0.0, "offshell_displacement": 0.0047, "angular_displacement": 0.0011, "fisher_at_layer": 18.2502, "cosine_dm_pca": 0.9955, "behavior_scorer": "generation", "safety_real": true, "composite_fingerprint": "a9001e87087e", "n_seeds": 1, "tier": "SCREENING", "elapsed_sec": 99.75, "timestamp": "2026-05-31T13:41:51", "experiment_num": 80, "status": "DISCARD"}
{"config": {"model": "models/google/gemma-3-270m-it", "rung": 2, "layer": 16, "alpha": 0.1, "operation": "relative_add", "source": "pca", "behavior": "ocean", "seed": 0, "tag": "C9b-relcliff-L16-a0.1-relative_add-pca", "quant": "none", "normalize": false}, "description": "E7 sweep C9b-relcliff-L16-a0.1-relative_add-pca", "rung": 2, "layer": 16, "composite": -1.6534, "behavior_efficacy": 0.5912, "capability_retention": 0.7, "mmlu_drop_pp": 0.0, "perplexity": 132.5849, "dppl_norm": 0.4697, "repetition_rate": 0.0145, "compliance_rate": 1.0, "harmful_refusal_rate": 0.0, "harmless_refusal_rate": 0.0, "selectivity_gap": 0.0, "offshell_displacement": 0.0101, "angular_displacement": 0.0045, "fisher_at_layer": 18.2502, "cosine_dm_pca": 0.9955, "behavior_scorer": "generation", "safety_real": true, "composite_fingerprint": "a9001e87087e", "n_seeds": 1, "tier": "SCREENING", "elapsed_sec": 126.97, "timestamp": "2026-05-31T13:44:32", "experiment_num": 81, "status": "DISCARD"}
{"config": {"model": "models/google/gemma-3-270m-it", "rung": 2, "layer": 16, "alpha": 0.2, "operation": "relative_add", "source": "pca", "behavior": "ocean", "seed": 0, "tag": "C9b-relcliff-L16-a0.2-relative_add-pca", "quant": "none", "normalize": false}, "description": "E7 sweep C9b-relcliff-L16-a0.2-relative_add-pca", "rung": 2, "layer": 16, "composite": -2.3047, "behavior_efficacy": 0.4752, "capability_retention": 0.65, "mmlu_drop_pp": 0.05, "perplexity": 255.4048, "dppl_norm": 1.8312, "repetition_rate": 0.0145, "compliance_rate": 0.9, "harmful_refusal_rate": 0.1, "harmless_refusal_rate": 0.0, "selectivity_gap": 0.1, "offshell_displacement": 0.0282, "angular_displacement": 0.0173, "fisher_at_layer": 18.2502, "cosine_dm_pca": 0.9955, "behavior_scorer": "generation", "safety_real": true, "composite_fingerprint": "a9001e87087e", "n_seeds": 1, "tier": "SCREENING", "elapsed_sec": 109.53, "timestamp": "2026-05-31T13:47:06", "experiment_num": 82, "status": "DISCARD"}
{"config": {"model": "models/google/gemma-3-270m-it", "rung": 2, "layer": 16, "alpha": 0.4, "operation": "relative_add", "source": "pca", "behavior": "ocean", "seed": 0, "tag": "C9b-relcliff-L16-a0.4-relative_add-pca", "quant": "none", "normalize": false}, "description": "E7 sweep C9b-relcliff-L16-a0.4-relative_add-pca", "rung": 2, "layer": 16, "composite": -11.0764, "behavior_efficacy": 0.3043, "capability_retention": 0.6, "mmlu_drop_pp": 0.1, "perplexity": 1759.2421, "dppl_norm": 18.5016, "repetition_rate": 0.0145, "compliance_rate": 1.0, "harmful_refusal_rate": 0.0, "harmless_refusal_rate": 0.0, "selectivity_gap": 0.0, "offshell_displacement": 0.0908, "angular_displacement": 0.0626, "fisher_at_layer": 18.2502, "cosine_dm_pca": 0.9955, "behavior_scorer": "generation", "safety_real": true, "composite_fingerprint": "a9001e87087e", "n_seeds": 1, "tier": "SCREENING", "elapsed_sec": 171.89, "timestamp": "2026-05-31T13:50:37", "experiment_num": 83, "status": "DISCARD"}
{"config": {"model": "models/google/gemma-3-1b-it", "rung": 2, "layer": 18, "alpha": 0.02, "operation": "relative_add", "source": "diffmean", "behavior": "ocean", "seed": 0, "tag": "C10-rel1b-L18-a0.02-relative_add-diffmean", "quant": "none", "normalize": false}, "description": "E7 sweep C10-rel1b-L18-a0.02-relative_add-diffmean", "rung": 2, "layer": 18, "composite": -0.9553, "behavior_efficacy": 0.4919, "capability_retention": 0.95, "mmlu_drop_pp": 0.0, "perplexity": 79.8435, "dppl_norm": 0.0794, "repetition_rate": 0.0145, "compliance_rate": 0.7, "harmful_refusal_rate": 0.3, "harmless_refusal_rate": 0.0, "selectivity_gap": 0.3, "offshell_displacement": 0.0011, "angular_displacement": 0.0002, "fisher_at_layer": 36.3461, "cosine_dm_pca": 0.9945, "behavior_scorer": "generation", "safety_real": true, "composite_fingerprint": "a9001e87087e", "n_seeds": 1, "tier": "SCREENING", "elapsed_sec": 166.39, "timestamp": "2026-05-31T13:57:12", "experiment_num": 84, "status": "DISCARD"}
{"config": {"model": "models/google/gemma-3-1b-it", "rung": 2, "layer": 18, "alpha": 0.05, "operation": "relative_add", "source": "diffmean", "behavior": "ocean", "seed": 0, "tag": "C10-rel1b-L18-a0.05-relative_add-diffmean", "quant": "none", "normalize": false}, "description": "E7 sweep C10-rel1b-L18-a0.05-relative_add-diffmean", "rung": 2, "layer": 18, "composite": -0.8395, "behavior_efficacy": 0.5192, "capability_retention": 0.95, "mmlu_drop_pp": 0.0, "perplexity": 96.2414, "dppl_norm": 0.301, "repetition_rate": 0.0145, "compliance_rate": 0.6, "harmful_refusal_rate": 0.4, "harmless_refusal_rate": 0.0, "selectivity_gap": 0.4, "offshell_displacement": 0.0036, "angular_displacement": 0.0011, "fisher_at_layer": 36.3461, "cosine_dm_pca": 0.9945, "behavior_scorer": "generation", "safety_real": true, "composite_fingerprint": "a9001e87087e", "n_seeds": 1, "tier": "SCREENING", "elapsed_sec": 127.17, "timestamp": "2026-05-31T13:59:55", "experiment_num": 85, "status": "DISCARD"}
{"config": {"model": "models/google/gemma-3-1b-it", "rung": 2, "layer": 18, "alpha": 0.1, "operation": "relative_add", "source": "diffmean", "behavior": "ocean", "seed": 0, "tag": "C10-rel1b-L18-a0.1-relative_add-diffmean", "quant": "none", "normalize": false}, "description": "E7 sweep C10-rel1b-L18-a0.1-relative_add-diffmean", "rung": 2, "layer": 18, "composite": -1.5176, "behavior_efficacy": 0.3789, "capability_retention": 0.95, "mmlu_drop_pp": 0.0, "perplexity": 175.5577, "dppl_norm": 1.3733, "repetition_rate": 0.0145, "compliance_rate": 0.6, "harmful_refusal_rate": 0.4, "harmless_refusal_rate": 0.0, "selectivity_gap": 0.4, "offshell_displacement": 0.0104, "angular_displacement": 0.0045, "fisher_at_layer": 36.3461, "cosine_dm_pca": 0.9945, "behavior_scorer": "generation", "safety_real": true, "composite_fingerprint": "a9001e87087e", "n_seeds": 1, "tier": "SCREENING", "elapsed_sec": 117.52, "timestamp": "2026-05-31T14:02:29", "experiment_num": 86, "status": "DISCARD"}
{"config": {"model": "models/google/gemma-3-1b-it", "rung": 2, "layer": 18, "alpha": 0.2, "operation": "relative_add", "source": "diffmean", "behavior": "ocean", "seed": 0, "tag": "C10-rel1b-L18-a0.2-relative_add-diffmean", "quant": "none", "normalize": false}, "description": "E7 sweep C10-rel1b-L18-a0.2-relative_add-diffmean", "rung": 2, "layer": 18, "composite": -4.9657, "behavior_efficacy": 0.4621, "capability_retention": 0.8, "mmlu_drop_pp": 0.15, "perplexity": 616.0931, "dppl_norm": 7.3286, "repetition_rate": 0.0145, "compliance_rate": 0.8, "harmful_refusal_rate": 0.2, "harmless_refusal_rate": 0.0, "selectivity_gap": 0.2, "offshell_displacement": 0.0251, "angular_displacement": 0.0175, "fisher_at_layer": 36.3461, "cosine_dm_pca": 0.9945, "behavior_scorer": "generation", "safety_real": true, "composite_fingerprint": "a9001e87087e", "n_seeds": 1, "tier": "SCREENING", "elapsed_sec": 122.76, "timestamp": "2026-05-31T14:05:28", "experiment_num": 87, "status": "DISCARD"}
{"config": {"model": "models/google/gemma-3-1b-it", "rung": 2, "layer": 18, "alpha": 0.4, "operation": "relative_add", "source": "diffmean", "behavior": "ocean", "seed": 0, "tag": "C10-rel1b-L18-a0.4-relative_add-diffmean", "quant": "none", "normalize": false}, "description": "E7 sweep C10-rel1b-L18-a0.4-relative_add-diffmean", "rung": 2, "layer": 18, "composite": -92.77, "behavior_efficacy": 0.4188, "capability_retention": 0.6, "mmlu_drop_pp": 0.35, "perplexity": 13508.9301, "dppl_norm": 181.6193, "repetition_rate": 0.0145, "compliance_rate": 1.0, "harmful_refusal_rate": 0.0, "harmless_refusal_rate": 0.0, "selectivity_gap": 0.0, "offshell_displacement": 0.0879, "angular_displacement": 0.0631, "fisher_at_layer": 36.3461, "cosine_dm_pca": 0.9945, "behavior_scorer": "generation", "safety_real": true, "composite_fingerprint": "a9001e87087e", "n_seeds": 1, "tier": "SCREENING", "elapsed_sec": 105.52, "timestamp": "2026-05-31T14:07:49", "experiment_num": 88, "status": "DISCARD"}
{"config": {"model": "models/google/gemma-3-270m-it", "rung": 2, "layer": 16, "alpha": 0.1, "operation": "relative_add", "source": "diffmean", "behavior": "ocean", "seed": 0, "tag": "HC-E7-base-0", "quant": "none", "normalize": false}, "description": "E7 hill-climb axis=base HC-E7-base-0", "rung": 2, "layer": 16, "composite": -1.6772, "behavior_efficacy": 0.6138, "capability_retention": 0.65, "mmlu_drop_pp": 0.05, "perplexity": 131.9343, "dppl_norm": 0.4625, "repetition_rate": 0.0145, "compliance_rate": 1.0, "harmful_refusal_rate": 0.0, "harmless_refusal_rate": 0.0, "selectivity_gap": 0.0, "offshell_displacement": 0.0101, "angular_displacement": 0.0045, "fisher_at_layer": 18.2502, "cosine_dm_pca": 0.9955, "behavior_scorer": "generation", "safety_real": true, "composite_fingerprint": "a9001e87087e", "n_seeds": 1, "tier": "SCREENING", "elapsed_sec": 234.04, "timestamp": "2026-05-31T22:57:35", "experiment_num": 89, "status": "DISCARD"}
{"config": {"model": "models/google/gemma-3-270m-it", "rung": 2, "layer": 16, "alpha": 0.05, "operation": "relative_add", "source": "diffmean", "behavior": "ocean", "seed": 0, "tag": "HC-E7-alpha-0.05", "quant": "none", "normalize": false}, "description": "E7 hill-climb axis=alpha HC-E7-alpha-0.05", "rung": 2, "layer": 16, "composite": -1.4181, "behavior_efficacy": 0.4447, "capability_retention": 0.7, "mmlu_drop_pp": 0.0, "perplexity": 99.9781, "dppl_norm": 0.1083, "repetition_rate": 0.0145, "compliance_rate": 0.9, "harmful_refusal_rate": 0.1, "harmless_refusal_rate": 0.0, "selectivity_gap": 0.1, "offshell_displacement": 0.0054, "angular_displacement": 0.0011, "fisher_at_layer": 18.2502, "cosine_dm_pca": 0.9955, "behavior_scorer": "generation", "safety_real": true, "composite_fingerprint": "a9001e87087e", "n_seeds": 1, "tier": "SCREENING", "elapsed_sec": 245.21, "timestamp": "2026-05-31T23:03:01", "experiment_num": 90, "status": "DISCARD"}
{"config": {"model": "models/google/gemma-3-270m-it", "rung": 2, "layer": 16, "alpha": 0.1, "operation": "relative_add", "source": "diffmean", "behavior": "ocean", "seed": 0, "tag": "HC-E7-alpha-0.1", "quant": "none", "normalize": false}, "description": "E7 hill-climb axis=alpha HC-E7-alpha-0.1", "rung": 2, "layer": 16, "composite": -1.6772, "behavior_efficacy": 0.6138, "capability_retention": 0.65, "mmlu_drop_pp": 0.05, "perplexity": 131.9343, "dppl_norm": 0.4625, "repetition_rate": 0.0145, "compliance_rate": 1.0, "harmful_refusal_rate": 0.0, "harmless_refusal_rate": 0.0, "selectivity_gap": 0.0, "offshell_displacement": 0.0101, "angular_displacement": 0.0045, "fisher_at_layer": 18.2502, "cosine_dm_pca": 0.9955, "behavior_scorer": "generation", "safety_real": true, "composite_fingerprint": "a9001e87087e", "n_seeds": 1, "tier": "SCREENING", "elapsed_sec": 77.88, "timestamp": "2026-05-31T23:05:11", "experiment_num": 91, "status": "DISCARD"}
{"config": {"model": "models/google/gemma-3-270m-it", "rung": 2, "layer": 16, "alpha": 0.15, "operation": "relative_add", "source": "diffmean", "behavior": "ocean", "seed": 0, "tag": "HC-E7-alpha-0.15", "quant": "none", "normalize": false}, "description": "E7 hill-climb axis=alpha HC-E7-alpha-0.15", "rung": 2, "layer": 16, "composite": -2.1108, "behavior_efficacy": 0.49, "capability_retention": 0.6, "mmlu_drop_pp": 0.1, "perplexity": 178.3253, "dppl_norm": 0.9768, "repetition_rate": 0.0145, "compliance_rate": 1.0, "harmful_refusal_rate": 0.0, "harmless_refusal_rate": 0.0, "selectivity_gap": 0.0, "offshell_displacement": 0.0209, "angular_displacement": 0.0098, "fisher_at_layer": 18.2502, "cosine_dm_pca": 0.9955, "behavior_scorer": "generation", "safety_real": true, "composite_fingerprint": "a9001e87087e", "n_seeds": 1, "tier": "SCREENING", "elapsed_sec": 74.0, "timestamp": "2026-05-31T23:07:03", "experiment_num": 92, "status": "DISCARD"}
