{"config": {"model": "models/google/gemma-3-270m-it", "rung": 2, "layer": 12, "alpha": 2.0, "operation": "add", "source": "diffmean", "behavior": "ocean", "seed": 0, "tag": "C1-E2-layer-L12-a2.0-add-diffmean", "quant": "none"}, "description": "E2 sweep C1-E2-layer-L12-a2.0-add-diffmean", "rung": 2, "layer": 12, "composite": -2.8888, "behavior_efficacy": 0.3192, "capability_retention": 0.6, "mmlu_drop_pp": 0.1, "perplexity": 322.3106, "dppl_norm": 2.5729, "repetition_rate": 0.0145, "compliance_rate": 0.9, "harmful_refusal_rate": 0.1, "harmless_refusal_rate": 0.0, "selectivity_gap": 0.1, "offshell_displacement": 0.0574, "fisher_at_layer": 30.5679, "cosine_dm_pca": 0.9943, "behavior_scorer": "generation", "safety_real": true, "composite_fingerprint": "a9001e87087e", "n_seeds": 1, "tier": "SCREENING", "elapsed_sec": 126.96, "timestamp": "2026-05-31T00:32:41", "experiment_num": 25, "status": "DISCARD"}
{"config": {"model": "models/google/gemma-3-270m-it", "rung": 2, "layer": 14, "alpha": 2.0, "operation": "add", "source": "diffmean", "behavior": "ocean", "seed": 0, "tag": "C1-E2-layer-L14-a2.0-add-diffmean", "quant": "none"}, "description": "E2 sweep C1-E2-layer-L14-a2.0-add-diffmean", "rung": 2, "layer": 14, "composite": -2.2878, "behavior_efficacy": 0.4785, "capability_retention": 0.65, "mmlu_drop_pp": 0.05, "perplexity": 253.1757, "dppl_norm": 1.8065, "repetition_rate": 0.0145, "compliance_rate": 0.9, "harmful_refusal_rate": 0.1, "harmless_refusal_rate": 0.0, "selectivity_gap": 0.1, "offshell_displacement": 0.0234, "fisher_at_layer": 17.2313, "cosine_dm_pca": 0.9922, "behavior_scorer": "generation", "safety_real": true, "composite_fingerprint": "a9001e87087e", "n_seeds": 1, "tier": "SCREENING", "elapsed_sec": 77.69, "timestamp": "2026-05-31T00:34:18", "experiment_num": 26, "status": "DISCARD"}
{"config": {"model": "models/google/gemma-3-270m-it", "rung": 2, "layer": 16, "alpha": 2.0, "operation": "add", "source": "diffmean", "behavior": "ocean", "seed": 0, "tag": "C1-E2-layer-L16-a2.0-add-diffmean", "quant": "none"}, "description": "E2 sweep C1-E2-layer-L16-a2.0-add-diffmean", "rung": 2, "layer": 16, "composite": -2.2706, "behavior_efficacy": 0.534, "capability_retention": 0.55, "mmlu_drop_pp": 0.15, "perplexity": 205.2632, "dppl_norm": 1.2754, "repetition_rate": 0.0145, "compliance_rate": 1.0, "harmful_refusal_rate": 0.0, "harmless_refusal_rate": 0.0, "selectivity_gap": 0.0, "offshell_displacement": 0.0383, "fisher_at_layer": 18.2502, "cosine_dm_pca": 0.9955, "behavior_scorer": "generation", "safety_real": true, "composite_fingerprint": "a9001e87087e", "n_seeds": 1, "tier": "SCREENING", "elapsed_sec": 77.49, "timestamp": "2026-05-31T00:35:47", "experiment_num": 27, "status": "DISCARD"}
{"config": {"model": "models/google/gemma-3-270m-it", "rung": 2, "layer": 16, "alpha": 1.0, "operation": "add", "source": "diffmean", "behavior": "ocean", "seed": 0, "tag": "C3-E27-op-L16-a1.0-add-diffmean", "quant": "none"}, "description": "E27 sweep C3-E27-op-L16-a1.0-add-diffmean", "rung": 2, "layer": 16, "composite": -1.7572, "behavior_efficacy": 0.4683, "capability_retention": 0.65, "mmlu_drop_pp": 0.05, "perplexity": 119.9942, "dppl_norm": 0.3302, "repetition_rate": 0.0145, "compliance_rate": 1.0, "harmful_refusal_rate": 0.0, "harmless_refusal_rate": 0.0, "selectivity_gap": 0.0, "offshell_displacement": 0.0125, "fisher_at_layer": 18.2502, "cosine_dm_pca": 0.9955, "behavior_scorer": "generation", "safety_real": true, "composite_fingerprint": "a9001e87087e", "n_seeds": 1, "tier": "SCREENING", "elapsed_sec": 97.27, "timestamp": "2026-05-31T00:39:33", "experiment_num": 28, "status": "DISCARD"}
{"config": {"model": "models/google/gemma-3-270m-it", "rung": 2, "layer": 16, "alpha": 2.0, "operation": "add", "source": "diffmean", "behavior": "ocean", "seed": 0, "tag": "C3-E27-op-L16-a2.0-add-diffmean", "quant": "none"}, "description": "E27 sweep C3-E27-op-L16-a2.0-add-diffmean", "rung": 2, "layer": 16, "composite": -2.2706, "behavior_efficacy": 0.534, "capability_retention": 0.55, "mmlu_drop_pp": 0.15, "perplexity": 205.2632, "dppl_norm": 1.2754, "repetition_rate": 0.0145, "compliance_rate": 1.0, "harmful_refusal_rate": 0.0, "harmless_refusal_rate": 0.0, "selectivity_gap": 0.0, "offshell_displacement": 0.0383, "fisher_at_layer": 18.2502, "cosine_dm_pca": 0.9955, "behavior_scorer": "generation", "safety_real": true, "composite_fingerprint": "a9001e87087e", "n_seeds": 1, "tier": "SCREENING", "elapsed_sec": 75.36, "timestamp": "2026-05-31T00:41:01", "experiment_num": 29, "status": "DISCARD"}
{"config": {"model": "models/google/gemma-3-270m-it", "rung": 2, "layer": 16, "alpha": 4.0, "operation": "add", "source": "diffmean", "behavior": "ocean", "seed": 0, "tag": "C3-E27-op-L16-a4.0-add-diffmean", "quant": "none"}, "description": "E27 sweep C3-E27-op-L16-a4.0-add-diffmean", "rung": 2, "layer": 16, "composite": -7.7545, "behavior_efficacy": 0.2957, "capability_retention": 0.5, "mmlu_drop_pp": 0.2, "perplexity": 1139.4129, "dppl_norm": 11.6306, "repetition_rate": 0.0145, "compliance_rate": 1.0, "harmful_refusal_rate": 0.0, "harmless_refusal_rate": 0.0, "selectivity_gap": 0.0, "offshell_displacement": 0.1104, "fisher_at_layer": 18.2502, "cosine_dm_pca": 0.9955, "behavior_scorer": "generation", "safety_real": true, "composite_fingerprint": "a9001e87087e", "n_seeds": 1, "tier": "SCREENING", "elapsed_sec": 80.54, "timestamp": "2026-05-31T00:42:34", "experiment_num": 30, "status": "DISCARD"}
{"config": {"model": "models/google/gemma-3-270m-it", "rung": 2, "layer": 16, "alpha": 1.0, "operation": "rotate", "source": "diffmean", "behavior": "ocean", "seed": 0, "tag": "C3-E27-op-L16-a1.0-rotate-diffmean", "quant": "none"}, "description": "E27 sweep C3-E27-op-L16-a1.0-rotate-diffmean", "rung": 2, "layer": 16, "composite": -214072288.1251, "behavior_efficacy": 0.1971, "capability_retention": 0.4, "mmlu_drop_pp": 0.3, "perplexity": 38623008138.9148, "dppl_norm": 428144572.0294, "repetition_rate": 0.0145, "compliance_rate": 1.0, "harmful_refusal_rate": 0.0, "harmless_refusal_rate": 0.0, "selectivity_gap": 0.0, "offshell_displacement": 0.0012, "fisher_at_layer": 18.2502, "cosine_dm_pca": 0.9955, "behavior_scorer": "generation", "safety_real": true, "composite_fingerprint": "a9001e87087e", "n_seeds": 1, "tier": "SCREENING", "elapsed_sec": 105.67, "timestamp": "2026-05-31T00:44:33", "experiment_num": 31, "status": "DISCARD"}
{"config": {"model": "models/google/gemma-3-270m-it", "rung": 2, "layer": 16, "alpha": 2.0, "operation": "rotate", "source": "diffmean", "behavior": "ocean", "seed": 0, "tag": "C3-E27-op-L16-a2.0-rotate-diffmean", "quant": "none"}, "description": "E27 sweep C3-E27-op-L16-a2.0-rotate-diffmean", "rung": 2, "layer": 16, "composite": -613258415028896.0, "behavior_efficacy": 0.1971, "capability_retention": 0.3, "mmlu_drop_pp": 0.4, "perplexity": 1.1064433019588178e+17, "dppl_norm": 1226516830057787.5, "repetition_rate": 0.0145, "compliance_rate": 1.0, "harmful_refusal_rate": 0.0, "harmless_refusal_rate": 0.0, "selectivity_gap": 0.0, "offshell_displacement": 0.0, "fisher_at_layer": 18.2502, "cosine_dm_pca": 0.9955, "behavior_scorer": "generation", "safety_real": true, "composite_fingerprint": "a9001e87087e", "n_seeds": 1, "tier": "SCREENING", "elapsed_sec": 99.65, "timestamp": "2026-05-31T00:46:30", "experiment_num": 32, "status": "DISCARD"}
{"config": {"model": "models/google/gemma-3-270m-it", "rung": 2, "layer": 16, "alpha": 4.0, "operation": "rotate", "source": "diffmean", "behavior": "ocean", "seed": 0, "tag": "C3-E27-op-L16-a4.0-rotate-diffmean", "quant": "none"}, "description": "E27 sweep C3-E27-op-L16-a4.0-rotate-diffmean", "rung": 2, "layer": 16, "composite": -1.1925595997991442e+16, "behavior_efficacy": 0.1971, "capability_retention": 0.1, "mmlu_drop_pp": 0.6, "perplexity": 2.1516208323407706e+18, "dppl_norm": 2.385119199598288e+16, "repetition_rate": 0.0145, "compliance_rate": 1.0, "harmful_refusal_rate": 0.0, "harmless_refusal_rate": 0.0, "selectivity_gap": 0.0, "offshell_displacement": 0.0004, "fisher_at_layer": 18.2502, "cosine_dm_pca": 0.9955, "behavior_scorer": "generation", "safety_real": true, "composite_fingerprint": "a9001e87087e", "n_seeds": 1, "tier": "SCREENING", "elapsed_sec": 135.94, "timestamp": "2026-05-31T00:49:02", "experiment_num": 33, "status": "DISCARD"}
{"config": {"model": "models/google/gemma-3-270m-it", "rung": 2, "layer": 16, "alpha": 1.0, "operation": "project_out", "source": "diffmean", "behavior": "ocean", "seed": 0, "tag": "C3-E27-op-L16-a1.0-project_out-diffmean", "quant": "none"}, "description": "E27 sweep C3-E27-op-L16-a1.0-project_out-diffmean", "rung": 2, "layer": 16, "composite": -1.3701, "behavior_efficacy": 0.271, "capability_retention": 0.75, "mmlu_drop_pp": 0.0, "perplexity": 96.1941, "dppl_norm": 0.0663, "repetition_rate": 0.0145, "compliance_rate": 0.8, "harmful_refusal_rate": 0.2, "harmless_refusal_rate": 0.0, "selectivity_gap": 0.2, "offshell_displacement": 0.0027, "fisher_at_layer": 18.2502, "cosine_dm_pca": 0.9955, "behavior_scorer": "generation", "safety_real": true, "composite_fingerprint": "a9001e87087e", "n_seeds": 1, "tier": "SCREENING", "elapsed_sec": 109.24, "timestamp": "2026-05-31T00:51:10", "experiment_num": 34, "status": "DISCARD"}
{"config": {"model": "models/google/gemma-3-270m-it", "rung": 2, "layer": 16, "alpha": 2.0, "operation": "project_out", "source": "diffmean", "behavior": "ocean", "seed": 0, "tag": "C3-E27-op-L16-a2.0-project_out-diffmean", "quant": "none"}, "description": "E27 sweep C3-E27-op-L16-a2.0-project_out-diffmean", "rung": 2, "layer": 16, "composite": -1.7748, "behavior_efficacy": 0.1971, "capability_retention": 0.65, "mmlu_drop_pp": 0.05, "perplexity": 110.8602, "dppl_norm": 0.2289, "repetition_rate": 0.0145, "compliance_rate": 0.9, "harmful_refusal_rate": 0.1, "harmless_refusal_rate": 0.0, "selectivity_gap": 0.1, "offshell_displacement": 0.0008, "fisher_at_layer": 18.2502, "cosine_dm_pca": 0.9955, "behavior_scorer": "generation", "safety_real": true, "composite_fingerprint": "a9001e87087e", "n_seeds": 1, "tier": "SCREENING", "elapsed_sec": 102.11, "timestamp": "2026-05-31T00:53:08", "experiment_num": 35, "status": "DISCARD"}
{"config": {"model": "models/google/gemma-3-270m-it", "rung": 2, "layer": 16, "alpha": 4.0, "operation": "project_out", "source": "diffmean", "behavior": "ocean", "seed": 0, "tag": "C3-E27-op-L16-a4.0-project_out-diffmean", "quant": "none"}, "description": "E27 sweep C3-E27-op-L16-a4.0-project_out-diffmean", "rung": 2, "layer": 16, "composite": -2.2909, "behavior_efficacy": 0.2634, "capability_retention": 0.65, "mmlu_drop_pp": 0.05, "perplexity": 178.7417, "dppl_norm": 0.9814, "repetition_rate": 0.0145, "compliance_rate": 1.0, "harmful_refusal_rate": 0.0, "harmless_refusal_rate": 0.0, "selectivity_gap": 0.0, "offshell_displacement": 0.0253, "fisher_at_layer": 18.2502, "cosine_dm_pca": 0.9955, "behavior_scorer": "generation", "safety_real": true, "composite_fingerprint": "a9001e87087e", "n_seeds": 1, "tier": "SCREENING", "elapsed_sec": 111.9, "timestamp": "2026-05-31T00:55:20", "experiment_num": 36, "status": "DISCARD"}
{"config": {"model": "models/google/gemma-3-270m-it", "rung": 2, "layer": 16, "alpha": 0.05, "operation": "rotate", "source": "diffmean", "behavior": "ocean", "seed": 0, "tag": "C3b-E27-smallrot-L16-a0.05-rotate-diffmean", "quant": "none"}, "description": "E27 sweep C3b-E27-smallrot-L16-a0.05-rotate-diffmean", "rung": 2, "layer": 16, "composite": -1.4156, "behavior_efficacy": 0.4975, "capability_retention": 0.65, "mmlu_drop_pp": 0.05, "perplexity": 100.2413, "dppl_norm": 0.1112, "repetition_rate": 0.0145, "compliance_rate": 0.9, "harmful_refusal_rate": 0.1, "harmless_refusal_rate": 0.0, "selectivity_gap": 0.1, "offshell_displacement": 0.0011, "angular_displacement": 0.0011, "fisher_at_layer": 18.2502, "cosine_dm_pca": 0.9955, "behavior_scorer": "generation", "safety_real": true, "composite_fingerprint": "a9001e87087e", "n_seeds": 1, "tier": "SCREENING", "elapsed_sec": 124.53, "timestamp": "2026-05-31T01:00:58", "experiment_num": 37, "status": "DISCARD"}
{"config": {"model": "models/google/gemma-3-270m-it", "rung": 2, "layer": 16, "alpha": 0.1, "operation": "rotate", "source": "diffmean", "behavior": "ocean", "seed": 0, "tag": "C3b-E27-smallrot-L16-a0.1-rotate-diffmean", "quant": "none"}, "description": "E27 sweep C3b-E27-smallrot-L16-a0.1-rotate-diffmean", "rung": 2, "layer": 16, "composite": -1.7174, "behavior_efficacy": 0.5692, "capability_retention": 0.65, "mmlu_drop_pp": 0.05, "perplexity": 131.4371, "dppl_norm": 0.457, "repetition_rate": 0.0145, "compliance_rate": 1.0, "harmful_refusal_rate": 0.0, "harmless_refusal_rate": 0.0, "selectivity_gap": 0.0, "offshell_displacement": 0.0032, "angular_displacement": 0.0046, "fisher_at_layer": 18.2502, "cosine_dm_pca": 0.9955, "behavior_scorer": "generation", "safety_real": true, "composite_fingerprint": "a9001e87087e", "n_seeds": 1, "tier": "SCREENING", "elapsed_sec": 94.16, "timestamp": "2026-05-31T01:02:49", "experiment_num": 38, "status": "DISCARD"}
{"config": {"model": "models/google/gemma-3-270m-it", "rung": 2, "layer": 16, "alpha": 0.2, "operation": "rotate", "source": "diffmean", "behavior": "ocean", "seed": 0, "tag": "C3b-E27-smallrot-L16-a0.2-rotate-diffmean", "quant": "none"}, "description": "E27 sweep C3b-E27-smallrot-L16-a0.2-rotate-diffmean", "rung": 2, "layer": 16, "composite": -2.6132, "behavior_efficacy": 0.4603, "capability_retention": 0.55, "mmlu_drop_pp": 0.15, "perplexity": 255.4366, "dppl_norm": 1.8316, "repetition_rate": 0.0145, "compliance_rate": 1.0, "harmful_refusal_rate": 0.0, "harmless_refusal_rate": 0.0, "selectivity_gap": 0.0, "offshell_displacement": 0.0019, "angular_displacement": 0.0184, "fisher_at_layer": 18.2502, "cosine_dm_pca": 0.9955, "behavior_scorer": "generation", "safety_real": true, "composite_fingerprint": "a9001e87087e", "n_seeds": 1, "tier": "SCREENING", "elapsed_sec": 99.65, "timestamp": "2026-05-31T01:04:46", "experiment_num": 39, "status": "DISCARD"}
{"config": {"model": "models/google/gemma-3-270m-it", "rung": 2, "layer": 16, "alpha": 0.3, "operation": "rotate", "source": "diffmean", "behavior": "ocean", "seed": 0, "tag": "C3b-E27-smallrot-L16-a0.3-rotate-diffmean", "quant": "none"}, "description": "E27 sweep C3b-E27-smallrot-L16-a0.3-rotate-diffmean", "rung": 2, "layer": 16, "composite": -4.5757, "behavior_efficacy": 0.4628, "capability_retention": 0.55, "mmlu_drop_pp": 0.15, "perplexity": 609.9547, "dppl_norm": 5.7615, "repetition_rate": 0.0145, "compliance_rate": 1.0, "harmful_refusal_rate": 0.0, "harmless_refusal_rate": 0.0, "selectivity_gap": 0.0, "offshell_displacement": 0.0021, "angular_displacement": 0.0411, "fisher_at_layer": 18.2502, "cosine_dm_pca": 0.9955, "behavior_scorer": "generation", "safety_real": true, "composite_fingerprint": "a9001e87087e", "n_seeds": 1, "tier": "SCREENING", "elapsed_sec": 97.52, "timestamp": "2026-05-31T01:06:42", "experiment_num": 40, "status": "DISCARD"}
{"config": {"model": "models/google/gemma-3-270m-it", "rung": 2, "layer": 16, "alpha": 0.5, "operation": "rotate", "source": "diffmean", "behavior": "ocean", "seed": 0, "tag": "C3b-E27-smallrot-L16-a0.5-rotate-diffmean", "quant": "none"}, "description": "E27 sweep C3b-E27-smallrot-L16-a0.5-rotate-diffmean", "rung": 2, "layer": 16, "composite": -63.5493, "behavior_efficacy": 0.2448, "capability_retention": 0.55, "mmlu_drop_pp": 0.15, "perplexity": 11210.6699, "dppl_norm": 123.2728, "repetition_rate": 0.0145, "compliance_rate": 1.0, "harmful_refusal_rate": 0.0, "harmless_refusal_rate": 0.0, "selectivity_gap": 0.0, "offshell_displacement": 0.002, "angular_displacement": 0.1116, "fisher_at_layer": 18.2502, "cosine_dm_pca": 0.9955, "behavior_scorer": "generation", "safety_real": true, "composite_fingerprint": "a9001e87087e", "n_seeds": 1, "tier": "SCREENING", "elapsed_sec": 99.25, "timestamp": "2026-05-31T01:08:42", "experiment_num": 41, "status": "DISCARD"}
{"config": {"model": "models/google/gemma-3-270m-it", "rung": 2, "layer": 16, "alpha": 0.05, "operation": "add", "source": "diffmean", "behavior": "ocean", "seed": 0, "tag": "C3b-E27-smallrot-L16-a0.05-add-diffmean", "quant": "none"}, "description": "E27 sweep C3b-E27-smallrot-L16-a0.05-add-diffmean", "rung": 2, "layer": 16, "composite": -1.1394, "behavior_efficacy": 0.4697, "capability_retention": 0.7, "mmlu_drop_pp": 0.0, "perplexity": 90.5322, "dppl_norm": 0.0036, "repetition_rate": 0.0145, "compliance_rate": 0.8, "harmful_refusal_rate": 0.2, "harmless_refusal_rate": 0.0, "selectivity_gap": 0.2, "offshell_displacement": 0.0004, "angular_displacement": 0.0, "fisher_at_layer": 18.2502, "cosine_dm_pca": 0.9955, "behavior_scorer": "generation", "safety_real": true, "composite_fingerprint": "a9001e87087e", "n_seeds": 1, "tier": "SCREENING", "elapsed_sec": 97.64, "timestamp": "2026-05-31T01:10:39", "experiment_num": 42, "status": "DISCARD"}
{"config": {"model": "models/google/gemma-3-270m-it", "rung": 2, "layer": 16, "alpha": 0.1, "operation": "add", "source": "diffmean", "behavior": "ocean", "seed": 0, "tag": "C3b-E27-smallrot-L16-a0.1-add-diffmean", "quant": "none"}, "description": "E27 sweep C3b-E27-smallrot-L16-a0.1-add-diffmean", "rung": 2, "layer": 16, "composite": -1.0835, "behavior_efficacy": 0.528, "capability_retention": 0.7, "mmlu_drop_pp": 0.0, "perplexity": 90.9326, "dppl_norm": 0.008, "repetition_rate": 0.0145, "compliance_rate": 0.8, "harmful_refusal_rate": 0.2, "harmless_refusal_rate": 0.0, "selectivity_gap": 0.2, "offshell_displacement": 0.0012, "angular_displacement": 0.0001, "fisher_at_layer": 18.2502, "cosine_dm_pca": 0.9955, "behavior_scorer": "generation", "safety_real": true, "composite_fingerprint": "a9001e87087e", "n_seeds": 1, "tier": "SCREENING", "elapsed_sec": 93.18, "timestamp": "2026-05-31T01:12:33", "experiment_num": 43, "status": "DISCARD"}
{"config": {"model": "models/google/gemma-3-270m-it", "rung": 2, "layer": 16, "alpha": 0.2, "operation": "add", "source": "diffmean", "behavior": "ocean", "seed": 0, "tag": "C3b-E27-smallrot-L16-a0.2-add-diffmean", "quant": "none"}, "description": "E27 sweep C3b-E27-smallrot-L16-a0.2-add-diffmean", "rung": 2, "layer": 16, "composite": -1.0575, "behavior_efficacy": 0.5647, "capability_retention": 0.75, "mmlu_drop_pp": 0.0, "perplexity": 92.7987, "dppl_norm": 0.0287, "repetition_rate": 0.0145, "compliance_rate": 0.8, "harmful_refusal_rate": 0.2, "harmless_refusal_rate": 0.0, "selectivity_gap": 0.2, "offshell_displacement": 0.0024, "angular_displacement": 0.0002, "fisher_at_layer": 18.2502, "cosine_dm_pca": 0.9955, "behavior_scorer": "generation", "safety_real": true, "composite_fingerprint": "a9001e87087e", "n_seeds": 1, "tier": "SCREENING", "elapsed_sec": 111.34, "timestamp": "2026-05-31T01:14:44", "experiment_num": 44, "status": "DISCARD"}
{"config": {"model": "models/google/gemma-3-270m-it", "rung": 2, "layer": 16, "alpha": 0.3, "operation": "add", "source": "diffmean", "behavior": "ocean", "seed": 0, "tag": "C3b-E27-smallrot-L16-a0.3-add-diffmean", "quant": "none"}, "description": "E27 sweep C3b-E27-smallrot-L16-a0.3-add-diffmean", "rung": 2, "layer": 16, "composite": -1.1355, "behavior_efficacy": 0.4954, "capability_retention": 0.7, "mmlu_drop_pp": 0.0, "perplexity": 94.3028, "dppl_norm": 0.0454, "repetition_rate": 0.0145, "compliance_rate": 0.8, "harmful_refusal_rate": 0.2, "harmless_refusal_rate": 0.0, "selectivity_gap": 0.2, "offshell_displacement": 0.0039, "angular_displacement": 0.0005, "fisher_at_layer": 18.2502, "cosine_dm_pca": 0.9955, "behavior_scorer": "generation", "safety_real": true, "composite_fingerprint": "a9001e87087e", "n_seeds": 1, "tier": "SCREENING", "elapsed_sec": 106.82, "timestamp": "2026-05-31T01:16:53", "experiment_num": 45, "status": "DISCARD"}
{"config": {"model": "models/google/gemma-3-270m-it", "rung": 2, "layer": 16, "alpha": 0.5, "operation": "add", "source": "diffmean", "behavior": "ocean", "seed": 0, "tag": "C3b-E27-smallrot-L16-a0.5-add-diffmean", "quant": "none"}, "description": "E27 sweep C3b-E27-smallrot-L16-a0.5-add-diffmean", "rung": 2, "layer": 16, "composite": -1.4229, "behavior_efficacy": 0.4852, "capability_retention": 0.65, "mmlu_drop_pp": 0.05, "perplexity": 99.0732, "dppl_norm": 0.0982, "repetition_rate": 0.0145, "compliance_rate": 0.9, "harmful_refusal_rate": 0.1, "harmless_refusal_rate": 0.0, "selectivity_gap": 0.1, "offshell_displacement": 0.0067, "angular_displacement": 0.0013, "fisher_at_layer": 18.2502, "cosine_dm_pca": 0.9955, "behavior_scorer": "generation", "safety_real": true, "composite_fingerprint": "a9001e87087e", "n_seeds": 1, "tier": "SCREENING", "elapsed_sec": 111.09, "timestamp": "2026-05-31T01:19:07", "experiment_num": 46, "status": "DISCARD"}
{"config": {"model": "models/google/gemma-3-270m-it", "rung": 2, "layer": 2, "alpha": 4.0, "operation": "add", "source": "diffmean", "behavior": "ocean", "seed": 0, "tag": "C4-N20-fragility-L2-a4.0-add-diffmean", "quant": "none"}, "description": "N20 sweep C4-N20-fragility-L2-a4.0-add-diffmean", "rung": 2, "layer": 2, "composite": -2.9992, "behavior_efficacy": 0.3815, "capability_retention": 0.65, "mmlu_drop_pp": 0.05, "perplexity": 363.928, "dppl_norm": 3.0342, "repetition_rate": 0.0145, "compliance_rate": 0.9, "harmful_refusal_rate": 0.1, "harmless_refusal_rate": 0.0, "selectivity_gap": 0.1, "offshell_displacement": 0.0254, "angular_displacement": 0.0021, "fisher_at_layer": 0.1996, "cosine_dm_pca": 0.5903, "behavior_scorer": "generation", "safety_real": true, "composite_fingerprint": "a9001e87087e", "n_seeds": 1, "tier": "SCREENING", "elapsed_sec": 135.05, "timestamp": "2026-05-31T01:23:19", "experiment_num": 47, "status": "DISCARD"}
