{"config": {"model": "models/google/gemma-3-270m-it", "rung": 2, "layer": 6, "seed": 0, "operation": "add", "source": "sae_ts", "behavior": "ocean+happiness+anger", "n_seeds": 1, "quant": "none", "tag": "E20-saets-3stack"}, "description": "E20 SAE-TS 3-stack (optimized vectors) Gram mass + coherence vs DiffMean", "rung": 2, "layer": 6, "composite": 0.0, "behavior_efficacy": 1.0, "capability_retention": 1.0, "mmlu_drop_pp": 0.0, "perplexity": 89.4475, "dppl_norm": -0.0085, "repetition_rate": 0.0, "compliance_rate": 0.0, "harmful_refusal_rate": 1.0, "harmless_refusal_rate": 0.0, "selectivity_gap": 1.0, "offshell_displacement": 0.0, "angular_displacement": 0.0, "fisher_at_layer": 0.0, "cosine_dm_pca": 0.0, "behavior_scorer": "method", "safety_real": false, "method": "sae_ts_3stack", "method_metric": "gram_mass", "method_value": 3.0, "method_extra": {"behaviors": ["ocean", "happiness", "anger"], "target_features": [[126, 111, 24, 108, 59, 78], [126, 111, 24, 108, 59, 78], [126, 111, 24, 108, 59, 78]], "ppl_base": 90.21, "ppl_stack": 89.447, "coherence": 1.0, "gram_mass": 3.0, "gram_reduction_vs_diffmean": -0.8734, "coherence_gap_vs_diffmean": 0.0014, "verdict": "FALSIFIED"}, "composite_fingerprint": "a9001e87087e", "n_seeds": 1, "tier": "SCREENING", "elapsed_sec": 172.72, "timestamp": "2026-06-01T18:20:15", "experiment_num": 113, "status": "DISCARD"}
{"config": {"model": "models/google/gemma-3-270m-it", "rung": 3, "layer": 16, "seed": 0, "operation": "relative_add", "source": "diffmean", "behavior": "ocean", "n_seeds": 20, "quant": "none", "tag": "E7-confirm-gemma-3-270m-it"}, "description": "E7 controlled n=20 confirmation: real vs matched-displacement random/shuffled", "rung": 3, "layer": 16, "composite": 0.0222, "behavior_efficacy": 0.0826, "capability_retention": 1.0, "mmlu_drop_pp": 0.0, "perplexity": 0.0, "dppl_norm": 0.0, "repetition_rate": 0.0, "compliance_rate": 0.0, "harmful_refusal_rate": 1.0, "harmless_refusal_rate": 0.0, "selectivity_gap": 1.0, "offshell_displacement": 0.0, "angular_displacement": 0.0, "fisher_at_layer": 0.0, "cosine_dm_pca": 0.0, "behavior_scorer": "lexicon_proxy", "safety_real": false, "method": "e7_confirm", "method_metric": "real_minus_shuffled_behavior", "method_value": 0.0222, "method_extra": {"instrument": "lexicon_proxy", "knee_alpha": 0.1, "primary_control": "shuffled_label", "wilcoxon_p": 0.005414436660454229, "bootstrap_ci": [0.009249160561660565, 0.03362269934926184], "holm_reject_at_knee": true, "ordinal_pass": false, "vs_random_p": 9.555744839077428e-05, "random_coherence": 0.0017232738950160806, "matched_coherence": true, "extraction_stability": 0.9403612386067417, "single_model_verdict": "PROVISIONAL"}, "composite_fingerprint": "a9001e87087e", "n_seeds": 20, "tier": "EVALUATION", "elapsed_sec": 1517.62, "timestamp": "2026-06-01T23:03:09", "experiment_num": 114, "status": "DISCARD"}
{"config": {"model": "models/google/gemma-3-1b-it", "rung": 3, "layer": 18, "seed": 0, "operation": "relative_add", "source": "diffmean", "behavior": "ocean", "n_seeds": 20, "quant": "none", "tag": "E7-confirm-gemma-3-1b-it"}, "description": "E7 controlled n=20 confirmation: real vs matched-displacement random/shuffled", "rung": 3, "layer": 18, "composite": -0.0194, "behavior_efficacy": 0.066, "capability_retention": 1.0, "mmlu_drop_pp": 0.0, "perplexity": 0.0, "dppl_norm": 0.0, "repetition_rate": 0.0, "compliance_rate": 0.0, "harmful_refusal_rate": 1.0, "harmless_refusal_rate": 0.0, "selectivity_gap": 1.0, "offshell_displacement": 0.0, "angular_displacement": 0.0, "fisher_at_layer": 0.0, "cosine_dm_pca": 0.0, "behavior_scorer": "lexicon_proxy", "safety_real": false, "method": "e7_confirm", "method_metric": "real_minus_shuffled_behavior", "method_value": -0.0194, "method_extra": {"instrument": "lexicon_proxy", "knee_alpha": 0.1, "primary_control": "shuffled_label", "wilcoxon_p": 0.13054070066070972, "bootstrap_ci": [-0.04076050251831502, 0.0012316112706737708], "holm_reject_at_knee": false, "ordinal_pass": false, "vs_random_p": 0.001413190930041048, "random_coherence": 0.3618057342840917, "matched_coherence": false, "extraction_stability": 0.9233600677680317, "single_model_verdict": "PROVISIONAL"}, "composite_fingerprint": "a9001e87087e", "n_seeds": 20, "tier": "EVALUATION", "elapsed_sec": 1988.67, "timestamp": "2026-06-01T23:39:00", "experiment_num": 115, "status": "DISCARD"}
{"config": {"model": "models/google/gemma-3-270m-it", "rung": 3, "layer": 16, "seed": 0, "operation": "relative_add", "source": "diffmean", "behavior": "ocean", "n_seeds": 20, "quant": "none", "tag": "E7-confirm-gemma-3-270m-it"}, "description": "E7 controlled n=20 confirmation: real vs matched-displacement random/shuffled", "rung": 3, "layer": 16, "composite": 0.135, "behavior_efficacy": 0.73, "capability_retention": 1.0, "mmlu_drop_pp": 0.0, "perplexity": 0.0, "dppl_norm": 0.0, "repetition_rate": 0.0, "compliance_rate": 0.0, "harmful_refusal_rate": 1.0, "harmless_refusal_rate": 0.0, "selectivity_gap": 1.0, "offshell_displacement": 0.0, "angular_displacement": 0.0, "fisher_at_layer": 0.0, "cosine_dm_pca": 0.0, "behavior_scorer": "gemini_judge", "safety_real": false, "method": "e7_confirm", "method_metric": "real_minus_shuffled_behavior", "method_value": 0.135, "method_extra": {"instrument": "gemini_judge", "knee_alpha": 0.1, "primary_control": "shuffled_label", "wilcoxon_p": 0.0003879482272605827, "bootstrap_ci": [0.08375000000000007, 0.18375000000000002], "holm_reject_at_knee": true, "ordinal_pass": false, "vs_random_p": 9.27703673578401e-05, "random_coherence": 0.0017232738950160806, "matched_coherence": true, "extraction_stability": 0.9403612386067417, "single_model_verdict": "PROVISIONAL"}, "composite_fingerprint": "a9001e87087e", "n_seeds": 20, "tier": "EVALUATION", "elapsed_sec": 1962.64, "timestamp": "2026-06-02T00:14:38", "experiment_num": 116, "status": "DISCARD"}
{"config": {"model": "models/google/gemma-3-1b-it", "rung": 3, "layer": 18, "seed": 0, "operation": "relative_add", "source": "diffmean", "behavior": "ocean", "n_seeds": 20, "quant": "none", "tag": "E7-confirm-gemma-3-1b-it"}, "description": "E7 controlled n=20 confirmation: real vs matched-displacement random/shuffled", "rung": 3, "layer": 18, "composite": 0.0963, "behavior_efficacy": 0.5487, "capability_retention": 1.0, "mmlu_drop_pp": 0.0, "perplexity": 0.0, "dppl_norm": 0.0, "repetition_rate": 0.0, "compliance_rate": 0.0, "harmful_refusal_rate": 1.0, "harmless_refusal_rate": 0.0, "selectivity_gap": 1.0, "offshell_displacement": 0.0, "angular_displacement": 0.0, "fisher_at_layer": 0.0, "cosine_dm_pca": 0.0, "behavior_scorer": "gemini_judge", "safety_real": false, "method": "e7_confirm", "method_metric": "real_minus_shuffled_behavior", "method_value": 0.0963, "method_extra": {"instrument": "gemini_judge", "knee_alpha": 0.1, "primary_control": "shuffled_label", "wilcoxon_p": 0.014422323229740838, "bootstrap_ci": [0.024999999999999988, 0.1625], "holm_reject_at_knee": true, "ordinal_pass": false, "vs_random_p": 0.00038494478771493383, "random_coherence": 0.3618057342840917, "matched_coherence": false, "extraction_stability": 0.9233600677680317, "single_model_verdict": "PROVISIONAL"}, "composite_fingerprint": "a9001e87087e", "n_seeds": 20, "tier": "EVALUATION", "elapsed_sec": 2590.97, "timestamp": "2026-06-02T00:59:53", "experiment_num": 117, "status": "DISCARD"}
{"config": {"model": "models/google/gemma-3-270m-it", "rung": 3, "layer": 16, "seed": 0, "operation": "relative_add", "source": "diffmean", "behavior": "concept500", "n_seeds": 500, "quant": "none", "tag": "E7-axbench-gemma-3-270m-it"}, "description": "E7 on AxBench concept500: real vs shuffled across 500 concepts (judge rubric)", "rung": 3, "layer": 16, "composite": -0.0103, "behavior_efficacy": 0.0459, "capability_retention": 1.0, "mmlu_drop_pp": 0.0, "perplexity": 0.0, "dppl_norm": 0.0, "repetition_rate": 0.0, "compliance_rate": 0.0, "harmful_refusal_rate": 1.0, "harmless_refusal_rate": 0.0, "selectivity_gap": 1.0, "offshell_displacement": 0.0, "angular_displacement": 0.0, "fisher_at_layer": 0.0, "cosine_dm_pca": 0.0, "behavior_scorer": "local_judge:Qwen2.5-7B-Instruct", "safety_real": false, "method": "e7_axbench", "method_metric": "mean_real_minus_shuffled", "method_value": -0.0103, "method_extra": {"instrument": "local_judge:Qwen2.5-7B-Instruct", "dataset": "concept500", "n_concepts": 500, "mean_real": 0.045899999999999996, "mean_shuffled": 0.0562, "wilcoxon_p": 1.4105721009937927e-06, "bootstrap_ci": [-0.014199999999999999, -0.0066], "ordinal_pass": false, "external_ready": false, "verdict": "DIRECTIONAL"}, "composite_fingerprint": "a9001e87087e", "n_seeds": 500, "tier": "EVALUATION", "elapsed_sec": 7086.56, "timestamp": "2026-06-04T12:18:17", "experiment_num": 118, "status": "DISCARD"}
{"config": {"model": "google/gemma-2-2b-it", "rung": 3, "layer": 20, "seed": 0, "operation": "relative_add", "source": "diffmean", "behavior": "concept500", "n_seeds": 500, "quant": "none", "tag": "E7-axbench-gemma-2-2b-it"}, "description": "E7 on AxBench concept500: real vs shuffled across 500 concepts (judge rubric)", "rung": 3, "layer": 20, "composite": 0.004, "behavior_efficacy": 0.1382, "capability_retention": 1.0, "mmlu_drop_pp": 0.0, "perplexity": 0.0, "dppl_norm": 0.0, "repetition_rate": 0.0, "compliance_rate": 0.0, "harmful_refusal_rate": 1.0, "harmless_refusal_rate": 0.0, "selectivity_gap": 1.0, "offshell_displacement": 0.0, "angular_displacement": 0.0, "fisher_at_layer": 0.0, "cosine_dm_pca": 0.0, "behavior_scorer": "local_judge:Qwen2.5-7B-Instruct", "safety_real": false, "method": "e7_axbench", "method_metric": "mean_real_minus_shuffled", "method_value": 0.004, "method_extra": {"instrument": "local_judge:Qwen2.5-7B-Instruct", "dataset": "concept500", "n_concepts": 500, "mean_real": 0.1382, "mean_shuffled": 0.13419999999999999, "wilcoxon_p": 0.010550775643912097, "bootstrap_ci": [0.0003000000000000013, 0.007699999999999999], "ordinal_pass": false, "external_ready": false, "verdict": "DIRECTIONAL"}, "composite_fingerprint": "a9001e87087e", "n_seeds": 500, "tier": "EVALUATION", "elapsed_sec": 7623.13, "timestamp": "2026-06-04T14:35:55", "experiment_num": 119, "status": "DISCARD"}
{"config": {"model": "google/gemma-2-2b-it", "rung": 3, "layer": 20, "seed": 0, "operation": "relative_add", "source": "diffmean", "behavior": "concept500", "n_seeds": 30, "quant": "none", "tag": "E3-axbench-gemma-2-2b-it"}, "description": "E3 alpha-coherence cliff on AxBench concept500 (30 concepts, local judge)", "rung": 3, "layer": 20, "composite": 0.1625, "behavior_efficacy": 0.1625, "capability_retention": 1.0, "mmlu_drop_pp": 0.0, "perplexity": 0.0, "dppl_norm": 0.0, "repetition_rate": 0.0, "compliance_rate": 0.0, "harmful_refusal_rate": 1.0, "harmless_refusal_rate": 0.0, "selectivity_gap": 1.0, "offshell_displacement": 0.0, "angular_displacement": 0.0, "fisher_at_layer": 0.0, "cosine_dm_pca": 0.0, "behavior_scorer": "local_judge:Qwen2.5-7B-Instruct", "safety_real": false, "method": "e3_axbench", "method_metric": "cliff_alpha", "method_value": 0.8, "method_extra": {"instrument": "local_judge:Qwen2.5-7B-Instruct", "curve": [{"alpha": 0.02, "behavior": 0.15, "fluency": 0.6188}, {"alpha": 0.05, "behavior": 0.1604, "fluency": 0.6604}, {"alpha": 0.1, "behavior": 0.1625, "fluency": 0.6771}, {"alpha": 0.2, "behavior": 0.1479, "fluency": 0.6646}, {"alpha": 0.4, "behavior": 0.1333, "fluency": 0.4583}, {"alpha": 0.8, "behavior": 0.0521, "fluency": 0.1062}], "peak_alpha": 0.1, "cliff_alpha": 0.8, "n_concepts": 30}, "composite_fingerprint": "a9001e87087e", "n_seeds": 30, "tier": "EVALUATION", "elapsed_sec": 1162.68, "timestamp": "2026-06-04T15:10:22", "experiment_num": 120, "status": "DISCARD"}
{"config": {"model": "google/gemma-2-2b-it", "rung": 3, "layer": 18, "seed": 0, "operation": "relative_add", "source": "diffmean", "behavior": "concept500", "n_seeds": 20, "quant": "none", "tag": "E2-axbench-gemma-2-2b-it"}, "description": "E2 layer sweep on AxBench concept500 (20 concepts, local judge)", "rung": 3, "layer": 18, "composite": 0.1844, "behavior_efficacy": 0.1844, "capability_retention": 1.0, "mmlu_drop_pp": 0.0, "perplexity": 0.0, "dppl_norm": 0.0, "repetition_rate": 0.0, "compliance_rate": 0.0, "harmful_refusal_rate": 1.0, "harmless_refusal_rate": 0.0, "selectivity_gap": 1.0, "offshell_displacement": 0.0, "angular_displacement": 0.0, "fisher_at_layer": 0.0, "cosine_dm_pca": 0.0, "behavior_scorer": "local_judge:Qwen2.5-7B-Instruct", "safety_real": false, "method": "e2_axbench", "method_metric": "best_layer", "method_value": 18.0, "method_extra": {"instrument": "local_judge:Qwen2.5-7B-Instruct", "curve": [{"layer": 6, "behavior": 0.1656, "fluency": 0.6094}, {"layer": 10, "behavior": 0.1625, "fluency": 0.6406}, {"layer": 14, "behavior": 0.1656, "fluency": 0.6062}, {"layer": 18, "behavior": 0.1844, "fluency": 0.6312}, {"layer": 20, "behavior": 0.1781, "fluency": 0.6687}, {"layer": 22, "behavior": 0.175, "fluency": 0.6188}], "best_layer": 18, "n_concepts": 20}, "composite_fingerprint": "a9001e87087e", "n_seeds": 20, "tier": "EVALUATION", "elapsed_sec": 1050.09, "timestamp": "2026-06-04T15:39:32", "experiment_num": 121, "status": "DISCARD"}
{"config": {"model": "google/gemma-2-2b-it", "rung": 3, "layer": 20, "seed": 0, "operation": "none", "source": "diffmean_vs_pca", "behavior": "concept500", "n_seeds": 100, "quant": "none", "tag": "E4-axbench-gemma-2-2b-it"}, "description": "E4 DiffMean-vs-PCA cosine on AxBench concept500 (100 concepts)", "rung": 3, "layer": 20, "composite": 0.6529, "behavior_efficacy": 0.6529, "capability_retention": 1.0, "mmlu_drop_pp": 0.0, "perplexity": 0.0, "dppl_norm": 0.0, "repetition_rate": 0.0, "compliance_rate": 0.0, "harmful_refusal_rate": 1.0, "harmless_refusal_rate": 0.0, "selectivity_gap": 1.0, "offshell_displacement": 0.0, "angular_displacement": 0.0, "fisher_at_layer": 0.0, "cosine_dm_pca": 0.0, "behavior_scorer": "geometry_cosine", "safety_real": false, "method": "e4_axbench", "method_metric": "mean_cosine_dm_pca", "method_value": 0.6529, "method_extra": {"mean_cosine": 0.6529269110649496, "median_cosine": 0.7291779135087891, "p5_cosine": 0.1889320499627496, "fraction_ge_0.9": 0.16, "n_concepts": 100}, "composite_fingerprint": "a9001e87087e", "n_seeds": 100, "tier": "EVALUATION", "elapsed_sec": 293.77, "timestamp": "2026-06-04T15:52:07", "experiment_num": 122, "status": "DISCARD"}
{"config": {"model": "google/gemma-2-2b-it", "rung": 3, "layer": 20, "seed": 0, "operation": "add", "source": "diffmean", "behavior": "concept500", "n_seeds": 20, "quant": "none", "tag": "E27-axbench-gemma-2-2b-it"}, "description": "E27 (source x operation grid) on AxBench concept500 (20 concepts, local judge)", "rung": 3, "layer": 20, "composite": 0.1781, "behavior_efficacy": 0.1781, "capability_retention": 1.0, "mmlu_drop_pp": 0.0, "perplexity": 0.0, "dppl_norm": 0.0, "repetition_rate": 0.0, "compliance_rate": 0.0, "harmful_refusal_rate": 1.0, "harmless_refusal_rate": 0.0, "selectivity_gap": 1.0, "offshell_displacement": 0.0, "angular_displacement": 0.0, "fisher_at_layer": 0.0, "cosine_dm_pca": 0.0, "behavior_scorer": "local_judge:Qwen2.5-7B-Instruct", "safety_real": false, "method": "e27_axbench", "method_metric": "rotate_vs_add", "method_value": -0.0032, "method_extra": {"instrument": "local_judge:Qwen2.5-7B-Instruct", "grid": [{"source": "diffmean", "operation": "add", "behavior": 0.1688, "coherence": 0.6813}, {"source": "diffmean", "operation": "rotate", "behavior": 0.1656, "coherence": 0.6813}, {"source": "pca", "operation": "add", "behavior": 0.1781, "coherence": 0.6438}, {"source": "pca", "operation": "rotate", "behavior": 0.1719, "coherence": 0.6531}], "best": {"source": "pca", "operation": "add", "behavior": 0.1781, "coherence": 0.6438}, "n_concepts": 20}, "composite_fingerprint": "a9001e87087e", "n_seeds": 20, "tier": "EVALUATION", "elapsed_sec": 516.47, "timestamp": "2026-06-04T16:10:54", "experiment_num": 123, "status": "DISCARD"}
{"config": {"model": "google/gemma-2-2b-it", "rung": 3, "layer": 20, "seed": 0, "operation": "add", "source": "diffmean", "behavior": "concept500", "n_seeds": 20, "quant": "none", "tag": "E36-axbench-gemma-2-2b-it"}, "description": "E36 (source x operation grid) on AxBench concept500 (20 concepts, local judge)", "rung": 3, "layer": 20, "composite": 0.1781, "behavior_efficacy": 0.1781, "capability_retention": 1.0, "mmlu_drop_pp": 0.0, "perplexity": 0.0, "dppl_norm": 0.0, "repetition_rate": 0.0, "compliance_rate": 0.0, "harmful_refusal_rate": 1.0, "harmless_refusal_rate": 0.0, "selectivity_gap": 1.0, "offshell_displacement": 0.0, "angular_displacement": 0.0, "fisher_at_layer": 0.0, "cosine_dm_pca": 0.0, "behavior_scorer": "local_judge:Qwen2.5-7B-Instruct", "safety_real": false, "method": "e36_axbench", "method_metric": "pca_vs_diffmean", "method_value": 0.0093, "method_extra": {"instrument": "local_judge:Qwen2.5-7B-Instruct", "grid": [{"source": "diffmean", "operation": "add", "behavior": 0.1688, "coherence": 0.6813}, {"source": "diffmean", "operation": "rotate", "behavior": 0.1656, "coherence": 0.6813}, {"source": "pca", "operation": "add", "behavior": 0.1781, "coherence": 0.6438}, {"source": "pca", "operation": "rotate", "behavior": 0.1719, "coherence": 0.6531}], "best": {"source": "pca", "operation": "add", "behavior": 0.1781, "coherence": 0.6438}, "n_concepts": 20}, "composite_fingerprint": "a9001e87087e", "n_seeds": 20, "tier": "EVALUATION", "elapsed_sec": 563.85, "timestamp": "2026-06-04T16:11:41", "experiment_num": 124, "status": "DISCARD"}
